{
  "reference_inventory_id": "refinv_door_left_lit",
  "project_id": "proj_door_left_lit",
  "source_id": "src_door_left_lit",
  "artist_meaning_id": "meaning_door_left_lit",
  "inventory_status": "active",
  "policy": {
    "main_character_video_default": "strongly_recommend",
    "locations_objects_default": "promote_when_specific_or_inspectable",
    "skip_all_references": false,
    "skip_all_references_waiver_ref": null,
    "reference_generation_mode": "ask",
    "notes": "Reference support is recommended by Artist OS, but planning or generation depends on artist gate decisions."
  },
  "medium_plan_refs": [
    {
      "medium_plan_type": "video_medium_plan",
      "medium_plan_id": "vmp_door_left_lit",
      "role": "scan_source"
    }
  ],
  "scan_history": [
    {
      "scan_id": "refscan_door_left_lit_video",
      "scanned_at": "2026-06-25T18:50:00Z",
      "scan_scope": "video_storyboard",
      "medium_plan_ref": "vmp_door_left_lit",
      "summary": "Found one identity-bearing implied host, one blocking-critical hallway, and one story-critical object.",
      "candidates_found": 3
    }
  ],
  "subjects": [
    {
      "reference_subject_id": "refsub_door_keeper",
      "subject_category": "character",
      "subject_subtype": "host",
      "display_name": "Door Keeper",
      "subject_slug": "door-keeper",
      "origin": "continuity_scan",
      "priority": "required_decision",
      "recommendation_reasons": [
        "main_character",
        "multi_shot_identity",
        "provider_drift_risk"
      ],
      "subject_status": "accepted_for_planning",
      "strategy_status": "accepted",
      "package_readiness": "planned",
      "planned_output_count": 3,
      "generated_output_count": 0,
      "accepted_output_count": 0,
      "decision_ref": "gate_character_reference_strategy",
      "source_evidence_refs": ["src_door_left_lit#implied-host"],
      "usage_context_refs": ["vmp_door_left_lit#storyboard_shots"],
      "character_template_refs": ["char_door_keeper"],
      "visual_reference_sheet_plan_refs": ["vrs_door_keeper_promoted_package"],
      "output_record_refs": [],
      "active_output_refs": [],
      "linked_subject_refs": [],
      "allowed_use_scope": [
        "prompt_planning",
        "storyboard_export",
        "provider_input"
      ],
      "provider_role_hints": [
        "identity_reference",
        "turnaround_reference",
        "detail_reference"
      ],
      "visible_paths": {
        "subject_dir": "Wondermint/Artist Library/Projects/door-left-lit/References/Characters/door-keeper",
        "review_drafts_dir": "Wondermint/Artist Library/Projects/door-left-lit/References/Characters/door-keeper/Review Drafts",
        "accepted_dir": "Wondermint/Artist Library/Projects/door-left-lit/References/Characters/door-keeper/Accepted"
      },
      "workspace_paths": {
        "subject_dir": "projects/proj_door_left_lit/assets/generated/references/characters/door-keeper",
        "review_drafts_dir": "projects/proj_door_left_lit/assets/generated/references/characters/door-keeper/review-drafts",
        "accepted_dir": "projects/proj_door_left_lit/assets/reference/characters/door-keeper/accepted"
      },
      "continuity_risk_level": "high",
      "risk_notes": [
        "Without references, later close-ups or full-body shots may invent a different host."
      ],
      "variants": [
        {
          "variant_id": "refvar_door_keeper_raincoat",
          "variant_slug": "raincoat",
          "variant_kind": "wardrobe_variant",
          "display_name": "Door Keeper Raincoat",
          "reference_kind": "wardrobe_variant",
          "active_output_refs": [],
          "expected_outputs": [
            {
              "reference_output_id": "refout_door_keeper_raincoat",
              "reference_image_id": "refimg_door_keeper_raincoat",
              "reference_kind": "wardrobe_variant",
              "output_role": "character_wardrobe_sheet",
              "output_status": "planned",
              "required_before": "optional",
              "readiness": "planned",
              "waiver_ref": null,
              "output_record_id": null,
              "output_record_refs": [],
              "visible_path": null,
              "workspace_path": null,
              "allowed_use_scope": ["prompt_planning"],
              "provider_role_hints": ["identity_reference"],
              "provider_input_allowed": true,
              "review_only": false,
              "notes": "Optional wardrobe variant linked to the same character identity."
            }
          ],
          "missing_outputs": ["character_wardrobe_sheet"],
          "visible_paths": {
            "subject_dir": "Wondermint/Artist Library/Projects/door-left-lit/References/Characters/door-keeper/Wardrobe/raincoat",
            "review_drafts_dir": "Wondermint/Artist Library/Projects/door-left-lit/References/Characters/door-keeper/Wardrobe/raincoat/Review Drafts",
            "accepted_dir": "Wondermint/Artist Library/Projects/door-left-lit/References/Characters/door-keeper/Wardrobe/raincoat/Accepted"
          },
          "workspace_paths": {
            "subject_dir": "projects/proj_door_left_lit/assets/generated/references/characters/door-keeper/wardrobe/raincoat",
            "review_drafts_dir": "projects/proj_door_left_lit/assets/generated/references/characters/door-keeper/wardrobe/raincoat/review-drafts",
            "accepted_dir": "projects/proj_door_left_lit/assets/reference/characters/door-keeper/wardrobe/raincoat/accepted"
          },
          "history": [
            {
              "event_id": "refevt_door_keeper_raincoat_planned",
              "event_type": "plan_created",
              "occurred_at": "2026-06-25T19:01:00Z",
              "summary": "Recorded optional wardrobe variant for later continuity planning.",
              "refs": ["refsub_door_keeper"]
            }
          ],
          "notes": "Variants are nested under the base character subject in v1."
        }
      ],
      "expected_outputs": [
        {
          "reference_output_id": "refout_door_keeper_identity",
          "reference_image_id": "refimg_door_keeper_identity",
          "reference_kind": "base_identity",
          "output_role": "character_identity_plate",
          "output_status": "planned",
          "required_before": "storyboard_export",
          "readiness": "planned",
          "waiver_ref": null,
          "output_record_id": null,
          "output_record_refs": [],
          "visible_path": null,
          "workspace_path": null,
          "allowed_use_scope": [
            "prompt_planning",
            "storyboard_export",
            "provider_input"
          ],
          "provider_role_hints": ["identity_reference"],
          "provider_input_allowed": true,
          "review_only": false,
          "notes": "Planned identity plate; no generation has happened."
        },
        {
          "reference_output_id": "refout_door_keeper_turnaround",
          "reference_image_id": "refimg_door_keeper_turnaround",
          "reference_kind": "base_identity",
          "output_role": "character_turnaround_sheet",
          "output_status": "planned",
          "required_before": "storyboard_export",
          "readiness": "planned",
          "waiver_ref": null,
          "output_record_id": null,
          "output_record_refs": [],
          "visible_path": null,
          "workspace_path": null,
          "allowed_use_scope": [
            "prompt_planning",
            "storyboard_export",
            "provider_input"
          ],
          "provider_role_hints": ["turnaround_reference"],
          "provider_input_allowed": true,
          "review_only": false,
          "notes": "Planned full-body turnaround; no generation has happened."
        },
        {
          "reference_output_id": "refout_door_keeper_macro",
          "reference_image_id": "refimg_door_keeper_macro",
          "reference_kind": "base_identity",
          "output_role": "character_macro_detail_card",
          "output_status": "planned",
          "required_before": "storyboard_export",
          "readiness": "planned",
          "waiver_ref": null,
          "output_record_id": null,
          "output_record_refs": [],
          "visible_path": null,
          "workspace_path": null,
          "allowed_use_scope": [
            "prompt_planning",
            "storyboard_export",
            "provider_input"
          ],
          "provider_role_hints": ["detail_reference"],
          "provider_input_allowed": true,
          "review_only": false,
          "notes": "Planned macro detail card; no generation has happened."
        }
      ],
      "missing_outputs": [
        "character_identity_plate",
        "character_turnaround_sheet",
        "character_macro_detail_card"
      ],
      "history": [
        {
          "event_id": "refevt_door_keeper_scanned",
          "event_type": "scan_created",
          "occurred_at": "2026-06-25T18:50:00Z",
          "summary": "Continuity scan promoted the implied host as a required decision.",
          "refs": ["refscan_door_left_lit_video"]
        },
        {
          "event_id": "refevt_door_keeper_strategy",
          "event_type": "strategy_decided",
          "occurred_at": "2026-06-25T19:00:00Z",
          "summary": "Artist accepted planning for the main character reference package.",
          "refs": ["gate_character_reference_strategy", "char_door_keeper", "vrs_door_keeper_promoted_package"]
        }
      ],
      "notes": "Accepted for planning; the actual images still require Generation Approval."
    },
    {
      "reference_subject_id": "refsub_hallway_threshold",
      "subject_category": "location",
      "subject_subtype": "setting",
      "display_name": "Hallway Threshold",
      "subject_slug": "hallway-threshold",
      "origin": "continuity_scan",
      "priority": "recommended",
      "recommendation_reasons": [